Accession,cutoff_high,cutoff_medium,optimized_cutoff_high,optimized_cutoff_medium,binarization,RF_F1_macro,best_model,similar_proteins,target_datapoints,similar_datapoints,total_datapoints
Q14524,5.0,4.0,5.0,4.0,3-class,0.7525,Model B (low),"O00555, O08562, O35433, O35505, O43497, O54898, O55017, O60840, O88420, O88427, O88457, O95180, P04774, P04775, P07293, P08104, P0C6U8, P0C6X7, P13864, P15381, P15384, P15388, P15389, P15390, P16389, P16390, P17658, P17659, P22002, P22460, P25122, P27732, P33534, P35498, P35499, P48547, P54282, P63142, Q00975, Q01118, Q01668, Q01815, Q02294, Q02485, Q02789, Q07652, Q13698, Q13936, Q15858, Q15878, Q16322, Q27YN9, Q5YLN7, Q62205, Q62968, Q63734, Q6QIY3, Q6R5A3, Q704Y3, Q8NEC5, Q8NER1, Q91ZR5, Q99246, Q99250, Q9EPK8, Q9EQ60, Q9ERZ8, Q9HBA0, Q9JIS7, Q9JJV9, Q9NY46, Q9P0X4, Q9UI33, Q9UQD0, Q9WTU3, Q9Y5Y9, Q9Z0Y8",329,7990,8319
Q14994,7.0,6.0,6.9,5.6,3-class,0.6005291005291005,Model A,"O00482, O18531, O35627, O42392, O54915, O75469, P03373, P04058, P06186, P06401, P08235, P10827, P10828, P11416, P11473, P11474, P13053, P14598, P18113, P20153, P20393, P22449, P35398, P41235, P45446, P45974, P48281, P49116, P49881, P49885, P51448, P51449, P51450, P55055, Q13133, Q13285, Q14995, Q28037, Q4W6D0, Q60641, Q60644, Q62755, Q63449, Q6RVD3, Q8I1M8, Q8MWR1, Q8MWR2, Q8MYA6, Q92753, Q96RI1, Q9PTN2, Q9R1A7, Q9Y5X4, Q9Z0Y9",59,7437,7496
Q15070,6.0,5.0,6.0,5.0,3-class,NaN,N/A,"P09960, P19602, P24527, P25043, Q05096, Q08460, Q12791, Q14694, Q62976",0,296,296
Q92484,6.0,5.0,6.0,5.0,3-class,NaN,N/A,None,0,0,0
Q96F85,6.0,5.0,6.0,5.0,3-class,NaN,N/A,None,0,0,0
Q9BTC0,6.0,5.0,6.0,5.0,3-class,NaN,N/A,"O14686, O75151, O95696, P29375, P36506, P36507, P41229, P51136, P55201, Q03164, Q12830, Q3UXZ9, Q62666, Q6P6R0, Q6ZMT4, Q8TEK3, Q9BUL5, Q9BY66, Q9H160, Q9NR48, Q9NRL2, Q9UGL1, Q9UIF8, Q9UIG0, Q9ULD4, Q9UPN9, Q9UPP1",0,1885,1885
Q9GZZ6,5.0,4.0,5.0,4.0,3-class,NaN,N/A,"O46128, O70174, P02708, P02710, P02712, P02714, P02716, P02718, P04755, P04756, P04757, P04760, P07510, P09478, P09482, P09483, P09660, P09690, P11230, P12389, P12390, P12391, P12392, P17644, P17787, P20420, P22770, P23979, P25108, P25109, P25110, P25162, P30532, P30926, P32297, P35563, P36544, P43143, P43144, P43681, P46098, P49582, P54131, P91764, Q04844, Q05901, Q05941, Q07001, Q15822, Q15825, Q2MKA5, Q5F2K1, Q5F2K2, Q5F2K3, Q7KT97, Q7KTF8, Q866A2, Q8BMN3, Q8R493, Q8R4G9, Q8WSF8, Q91X60, Q9ERK7, Q9JLB5, Q9NFX8, Q9R0W9, Q9U940, Q9U941, Q9UGM1, Q9W3G6",0,2373,2373
Q9NPD5,6.0,5.0,5.7,4.8,3-class,NaN,N/A,"O35913, O94956, P10569, P20827, P24942, P30994, P43003, P46720, P46721, P48664, P70502, Q00910, Q01705, Q6ZQN7, Q92959, Q9EPT5, Q9ERB5, Q9H5I1, Q9JHI3, Q9Y6L6",15,626,641
Q9UGM1,5.0,4.0,5.0,4.0,3-class,NaN,N/A,"O46128, O60503, O70174, P02708, P02710, P02712, P02714, P02716, P02718, P04755, P04756, P04757, P04760, P07510, P09478, P09482, P09483, P09690, P12389, P12390, P12391, P12392, P17644, P17787, P20420, P22770, P25108, P25110, P25162, P30532, P30926, P32297, P36544, P43143, P43144, P43681, P49582, P54131, P91764, Q05901, Q05941, Q07001, Q15822, Q15825, Q2MKA5, Q5F2K1, Q5F2K2, Q5F2K3, Q7KT97, Q7KTF8, Q866A2, Q8BMN3, Q8R493, Q8R4G9, Q91X60, Q9ERK7, Q9GZZ6, Q9JLB5, Q9NFX8, Q9R0W9, Q9U940, Q9U941, Q9W3G6",0,1817,1817
